id,Address,found_address,coordinates
6523,"մարշալ խուդյակով փողոցի 5-րդ նրբանցք 1/1, երևան","Armenia, Yerevan, Shirak Street 5th Lane, 1/1A","40.139706,44.434016"
6524,"տիտոգրադյան փողոց, երևան","Armenia, Yerevan, Titogradyan Street","40.130977,44.524467"
6529,"հալաբյան փողոց 37, երևան","Armenia, Yerevan, Halabyan Street, 37","40.198201,44.478994"
6535,"գյուլիքեխվյան նրբանցք, երևան","Armenia, Yerevan, 1st Street 10 alley","40.143436,44.543206"
6547,"պարույր սևակի փողոց 5, երևան","Armenia, Yerevan, Paruyr Sevak Street, 5","40.210592,44.534555"
6551,"մոլդովական փողոց 29/4, երևան","Armenia, Yerevan, Moldovakan Street, 29/4","40.207596,44.571359"
6566,"улица андраника зоравара, yerevan","Armenia, Yerevan, Zoravar Andranik Street","40.175162,44.44573"
6568,"բագրատունյաց փողոց 24a, երևան","Armenia, Yerevan, Bagratunyats Street, 24A","40.148951,44.48469"
6581,"վահան տերյանի փողոց, երևան",,
6583,"մայակ թաղամաս 1, երևան","Armenia, Yerevan, The Administrative District of Nor Nork, Mayak Quarter, 1","40.187082,44.595245"
6616,"հունան ավետիսյան փողոց 37, երևան","Armenia, Yerevan, Hunan Avetisyan Street, 37","40.175506,44.565089"
6618,"վազգեն սարգսյանի փողոց, երևան","Armenia, Kotayk Region, Village of Kasakh, Vazgen Sargsyan Street","40.239622,44.452494"
6621,"սևաստոպոլյան փողոց, երևան","Armenia, Yerevan, Sevastopolyan Street","40.195452,44.486953"
6626,"արշակունյաց պողոտա 127/13, երևան","Armenia, Yerevan, Arshakunyats Avenue, 127/13","40.131391,44.48866"
6628,"ագաթանգեղոսի փողոց , երևան","Armenia, Yerevan, Agatangeghos Street","40.172364,44.511325"
6629,"րաֆֆու փողոց 115, երևան","Armenia, Yerevan, Raffi Street, 115","40.170806,44.413031"
6638,"տիգրան պետրոսյան փողոց , երևան","Armenia, Yerevan, Tigran Petrosyan Street","40.222898,44.495784"
6646,"ամիրյան փողոց 12, երևան","Armenia, Yerevan, Amiryan Street, 12","40.180702,44.508432"
6649,"շիրակի փողոց 72, երևան","Armenia, Yerevan, Shirak Street, 72","40.149599,44.45173"
6655,"արմեն տիգրանյանի փողոց 38, երևան","Armenia, Yerevan, Armen Tigranyan Street, 38","40.200026,44.525545"
6660,"տիգրան պետրոսյանի փողոց 1/7, երևան","Armenia, Yerevan, Tigran Petrosyan Street, 1/7","40.217423,44.486971"
6680,"դավթաշեն 4-րդ թաղամաս 2/9, երևան","Armenia, Yerevan, The Administrative District of Davtashen, Davtashen 4th Block, 2/9","40.224268,44.498883"
6690,"զաքարիա սարկավագի 6-րդ նրբանցք, երևան","Armenia, Yerevan, High Park Yerevan Residential Complex","40.222216,44.551443"
6691,"գուսան շերամի փողոց 109, երևան","Armenia, Yerevan, Gusan Sheram Street, 109","40.176009,44.439963"
6697,"շենգավիթ վարչական շրջան , երևան","Armenia, Yerevan, The Administrative District of Shengavit","40.148496,44.490789"
6699,"40.212044, 44.538680, երևան","Armenia, Yerevan","40.177642,44.512519"
6705,"մալաթիա-սեբաստիա վարչական շրջան, երևան","Armenia, Yerevan, The Administrative District of Malatia-Sebastia","40.173811,44.457587"
6723,"21-я улица арабкир, ереван","Armenia, Yerevan, Slavik Chiloyan Street, 21","40.200687,44.510157"
6735,"սպենդիարյան փողոց, երևան","Armenia, Yerevan, Spendiaryan Street","40.187392,44.512358"
6739,"մարգարյան փողոց 41, երևան","Armenia, Yerevan, Margaryan Street, 41","40.203332,44.470362"
6742,"ֆուչիկի փողոց 1/3, երևան","Armenia, Yerevan, Fuchik Street, 1/3","40.199881,44.477063"
6751,"թբիլիսյան խճուղի 3, երևան","Armenia, Yerevan, Tbilisyan Highway, 3","40.221053,44.529435"
6757,"հալաբյան փողոց 75/1, երևան","Armenia, Yerevan, Halabyan Street, 75/1G","40.210654,44.478905"
6759,"սարի թաղ 7-րդ փողոց, երևան","Armenia, Yerevan, Sari Tagh 7th Street","40.162171,44.525096"
6766,"մարո մարգարյան փողոց, երևան","Armenia, Yerevan, Maro Margaryan Street","40.199936,44.510453"
6778,"զաքարիա քանաքեռցու փողոց 117/2, երևան","Armenia, Yerevan, Zakaria Kanakertsi Street, 117/2","40.224365,44.544212"
6783,"muratsan street 126/6, yerevan","Armenia, Yerevan, Muratsan Street, 126/5","40.147648,44.515879"
6794,"մանթաշյան փողոց 10ա, երևան","Armenia, Yerevan, Mantashyan Street, 10A","40.149633,44.491382"
6806,"օհանովի փողոց 50, երևան","Armenia, Yerevan, Ohanov Street, 50","40.179206,44.449952"
6817,"պռոշյան փողոց, երևան","Armenia, Yerevan, Proshyan Street","40.189769,44.50395"
6835,"նարեկացի թաղամաս, երևան","Armenia, Yerevan, The Administrative District of Avan, Narekatsi District","40.219634,44.580639"
6844,"դավթաշեն 4-րդ թաղամաս 25/1, երևան","Armenia, Yerevan, The Administrative District of Davtashen, Davtashen 4th Block, 25/1","40.220632,44.499162"
6847,"օրբելի եղբայրների փողոց 16, երևան","Armenia, Yerevan, Orbeli Brothers Street, 16","40.193489,44.490241"
6850,"նազարբեկյան թաղամաս 44, երևան","Armenia, Yerevan, The Administrative District of Ajapnyak, Nazarbekyan Quarter, 44","40.215034,44.458019"
6852,"սասնա ծռերի փողոց 2, երևան","Armenia, Yerevan, Sasna Tsrer Street, 2","40.214235,44.490771"
6860,"սեբաստիայի փողոց 30, երևան","Armenia, Yerevan, Sebastia Street, 30","40.17993,44.45889"
6865,"վահրամ փափազյան փողոց 26, երևան","Armenia, Yerevan, Vahram Papazyan Street, 26","40.2069,44.500671"
6873,"զաքյան փողոց 2, երևան","Armenia, Yerevan, Zaqyan Street, 2","40.179069,44.509429"
6875,"արգիշտիի փողոց 7/10, երևան","Armenia, Yerevan, Argishti Street, 7/10","40.169201,44.503842"
6878,"թոթովենցի նրբանցք, երևան","Armenia, Yerevan, Totovents Street","40.203132,44.568997"
6882,"նորագյուղ թաղամաս, երևան","Armenia, Yerevan, The Administrative District of Kentron, Noragyugh District","40.167388,44.493143"
6883,"ղափանցյան փողոց 13, երևան","Armenia, Yerevan, Ghapantsyan Street, 13/8","40.218987,44.512636"
6904,"վերին շենգավիթի 2-րդ փողոց 20/2, երևան","Armenia, Yerevan, Verin Shengavit 2nd Street, 20/2","40.154107,44.493799"
6905,"ղազար փարպեցու փողոց 26, երևան","Armenia, Yerevan, Ghazar Parpetsi Street, 26","40.185766,44.511558"
6918,"փարպեցու փողոց, երևան","Armenia, Yerevan, Ghazar Parpetsi Street","40.184953,44.510319"
6926,"սեբաստիայի փողոց 3/9, երևան","Armenia, Yerevan, Sebastia Street, 3/9","40.188652,44.463552"
6931,"զորավար անդրանիկ բ2 թաղամաս 21, երևան","Armenia, Yerevan, The Administrative District of Malatia-Sebastia, Zoravar Andranik District, B2 of Zoravar Andranik Neighbourhood unit, 21","40.165259,44.443116"
6944,"կարապետ ուլնեցու 3-րդ փակուղի, երևան","Armenia, Yerevan, Karapet Ulnetsu Street 3nd Deadlock","40.209104,44.539253"
6945,"ավետ ավետիսյան փողոց 67, երևան","Armenia, Yerevan, Avet Avetisyan Street, 67","40.199943,44.504084"
6948,"բրյուսովի փողոց 28, երևան","Armenia, Yerevan, Bryusov Street, 28","40.168539,44.503267"
6949,"պարոնյան փողոց 28a, երևան","Armenia, Yerevan, Paronyan Street, 28A","40.180591,44.500231"
6962,"մալաթիա-սեբաստիա վարչական շրջան , երևան","Armenia, Yerevan, The Administrative District of Malatia-Sebastia","40.173811,44.457587"
6966,"բաղրամյան պողոտա 2/83, երևան","Armenia, Yerevan, Baghramyan Avenue, 2","40.188914,44.514109"
6975,"խորենացու փողոց 29, երևան","Armenia, Yerevan, Khorenatsi Street, 29","40.173287,44.511468"
6976,"կոմիտասի պողոտա , երևան","Armenia, Yerevan, Komitas Avenue","40.206239,44.50721"
6978,"ներքին շենգավիթի 11-րդ փողոց 39/1, երևան","Armenia, Yerevan, Vahram Aristakesyan Street, 39/1","40.138361,44.481599"
6979,"դավթաշենի 1-ին զանգված 75, երևան","Armenia, Yerevan, Araratyan First Array","40.166975,44.464064"
6980,"ծովակալ իսակովի պողոտա 44, երևան","Armenia, Yerevan, Tsovakal Isakov Avenue, 44","40.161344,44.443888"
6984,"pushkin street, yerevan","Armenia, Yerevan, Pushkin Street","40.182913,44.512349"
6998,"դավիթ հովհաննեսի փողոց 6, երևան","Armenia, Yerevan, Davit Hovhannes Street, 6","40.201569,44.507435"
7006,"tsarav aghbyur street 134/4, yerevan","Armenia, Yerevan, Tsarav Akhpyur Street, 134/4","40.21597,44.5498"
7012,"առնո բաբաջանյան փողոց 8, երևան","Armenia, Yerevan, Arno Babajanyan Street, 8","40.172295,44.435794"
7016,"դավթաշեն 4-րդ թաղամաս 48/1, երևան","Armenia, Yerevan, The Administrative District of Davtashen, Davtashen 4th Block, 48/1","40.224117,44.500428"
7021,"rafael lemkin street, yerevan","Armenia, Yerevan, Rafael Lemkin Street","40.189031,44.511504"
7025,"բրյուսովի փողոց 38, երևան","Armenia, Yerevan, Bryusov Street, 38","40.168463,44.502845"
7033,"շահամիրյանների փողոց, երևան","Armenia, Yerevan, Shahamiryanner Street","40.14196,44.485804"
7042,"իսահակյան թաղամաս, երևան","Armenia, Yerevan, The Administrative District of Avan, Isahakyan District","40.216459,44.577827"
7065,"շահսուվարյան փողոց 5, երևան","Armenia, Yerevan, Shahsuvaryan Street, 5","40.207582,44.522688"
7073,"դավթաշեն 4-րդ թաղամաս 49, երևան","Armenia, Yerevan, The Administrative District of Davtashen, Davtashen 4th Block, 49","40.22369,44.500374"
7084,"առնո բաբաջանյան փողոց 49, երևան","Armenia, Yerevan, Arno Babajanyan Street, 49","40.168615,44.440349"
7087,"նոր արեշի 35-րդ փողոց 127/2, երևան","Armenia, Yerevan, Nor Aresh 35th Street, 127/2","40.132804,44.524925"
7090,"արամ խաչատրյան փողոց 18, երևան","Armenia, Yerevan, Aram Khachatryan Street, 18","40.205433,44.499126"
7092,"բաղրամյան պողոտա , երևան","Armenia, Yerevan, Baghramyan Avenue","40.192249,44.504093"
7102,"40.21721, 44.58273, երևան","Armenia, Yerevan","40.177642,44.512519"
7104,"հանրապետության հրապարակ , երևան","Armenia, Yerevan, Republic Square","40.17787,44.512888"
7114,"ազատության պողոտա 7a, երևան","Armenia, Yerevan, Azatutyan Avenue, 7A","40.20141,44.521404"
7123,"armen gulakyan street, yerevan","Armenia, Yerevan, Armen Gulakyan Street","40.196947,44.501919"
7125,"կիևյան փողոց 7, երևան","Armenia, Yerevan, Kievyan Street, 7","40.195046,44.487807"
7135,"քանաքեռ-զեյթուն վարչական շրջան , երևան","Armenia, Yerevan, The Administrative District of Kanaker-Zeytun","40.211948,44.539738"
7138,"մամիկոնյան փողոց, yerevan","Armenia, Ararat Region, Hayanist village, ulitsa V. Mamikonyana","40.124198,44.374412"
7141,"դավիթ մալյան փողոցի նրբանցք 4, երևան","Armenia, Yerevan, Davit Malyan Street Lane, 4","40.206873,44.566634"
7145,"բուզանդի փողոց, երևան","Armenia, Yerevan, Pavstos Buzand Street","40.178193,44.514442"
7150,"գայի պողոտա 1/1, երևան","Armenia, Yerevan, Gai Avenue, 1/1","40.205605,44.564325"
7159,"norashen district, yerevan","Armenia, Yerevan, The Administrative District of Ajapnyak, Norashen Quarter","40.213333,44.469634"
7186,"մայակ թաղամաս 26, երևան","Armenia, Yerevan, The Administrative District of Nor Nork, Mayak Quarter, 26","40.18538,44.594652"
7187,"աբելյան փողոց 2/2, երևան","Armenia, Yerevan, Abelyan Street, 2/1","40.199227,44.478078"
7189,"բրյուսովի փողոց 165a, երևան","Armenia, Yerevan, Bryusov Street, 165A","40.166692,44.502719"
7205,"նար-դոսի փողոց 75, երևան","Armenia, Yerevan, Nar-Dos Street, 75","40.167037,44.520191"
7210,"մոսկովյան փողոց 28, երևան","Armenia, Yerevan, Moskovyan Street, 28","40.18817,44.511298"
7218,"մոլդովական փողոց 43/4, երևան","Armenia, Yerevan, Moldovakan Street, 43/4","40.198876,44.574153"
7220,"տիգրան պետրոսյան փողոց 40, երևան","Armenia, Yerevan, Tigran Petrosyan Street, 40","40.221156,44.49396"
7223,"տիգրան պետրոսյանի փողոց 45, երևան","Armenia, Yerevan, Shirak Street, 45","40.141995,44.440942"
7225,"սլավիկ չիլոյան փողոց 18, երևան","Armenia, Yerevan, Slavik Chiloyan Street, 18","40.200439,44.510381"
7231,"պուշկինի փողոց 36, երևան","Armenia, Yerevan, Pushkin Street, 36","40.182293,44.513499"
7249,"ակսել բակունց փողոցի 1-ին նրբանցք, երևան","Armenia, Yerevan, Aksel Bakunts Street 1st Lane","40.191112,44.573587"
7264,"arzumanyan street, yerevan","Armenia, Yerevan, Arzumanyan Street","40.193137,44.473497"
7266,"արշակունյաց պողոտա 48/1, երևան","Armenia, Yerevan, Arshakunyats Avenue, 48/1","40.148737,44.49688"
7273,"վրացական փողոցի 4-րդ նրբանցք, երևան","Armenia, Yerevan, Vratsakan Street 4th lane","40.208574,44.509241"
7284,"gay avenue, yerevan","Armenia, Yerevan","40.177642,44.512519"
7287,"նոյ թաղամաս, երևան","Armenia, Yerevan, The Administrative District of Malatia-Sebastia, Noy District","40.185504,44.467622"
7294,"վահրամ փափազյան փողոց 11, երևան","Armenia, Yerevan, Vahram Papazyan Street, 11","40.199537,44.505081"
7297,"դավիթ մալյան փողոցի նրբանցք 2, երևան","Armenia, Yerevan, Davit Malyan Street Lane, 2","40.206811,44.565215"
7311,"շևչենկոյի փողոց 10, երևան","Armenia, Yerevan, Shevchenko Street, 10","40.15623,44.483773"
7314,"улица наири зарьяна, ереван","Armenia, Yerevan, Nairi Zaryan Street","40.20431,44.515502"
7317,"տիգրան մեծի պողոտա 63, երևան","Armenia, Yerevan, Tigran Mets Avenue, 63","40.158201,44.511603"
7318,"վազգեն սարգսյան փողոց 10, երևան","Armenia, Yerevan, Vazgen Sargsyan Street, 10","40.17614,44.511343"
7331,"գյուլբենկյան փողոց 30/3, երևան","Armenia, Yerevan, Gyulbenkyan Street, 30/3","40.200343,44.496368"
7361,"ամիրյան փողոց 4/4, երևան","Armenia, Yerevan, Amiryan Street, 4/4","40.179406,44.51101"
7365,"մանթաշյան փողոց 4/7, երևան","Armenia, Yerevan, Mantashyan Street, 4/7","40.150846,44.491499"
7366,"աբովյան փողոց 1/1, երևան","Armenia, Yerevan, Abovyan Street, 1/1","40.179261,44.513238"
7384,"զորավար անդրանիկ բ2 թաղամաս 138, երևան","Armenia, Yerevan, The Administrative District of Malatia-Sebastia, Zoravar Andranik District, B2 of Zoravar Andranik Neighbourhood unit, 138","40.166816,44.447517"
7401,"արաբկիր վարչական շրջան, երևան","Armenia, Yerevan, The Administrative District of Arabkir","40.207286,44.50942"
7407,"նար-դոսի փողոց 34, երևան","Armenia, Yerevan, Nar-Dos Street, 34","40.165128,44.517011"
7409,"քանաքեռ-զեյթուն վարչական շրջան, երևան","Armenia, Yerevan, The Administrative District of Kanaker-Zeytun","40.211948,44.539738"
7413,"շարուրի փողոց 3, երևան","Armenia, Yerevan, Sharuri Street, 3","40.14305,44.465286"
7431,"արգիշտի փողոց 31, երևան","Armenia, Yerevan, Argishti Street, 36","40.173542,44.498658"
7432,"eghishe tadevosyan street, երևան","Armenia, Yerevan, Yeghishe Tadevosyan Street Lane","40.143546,44.486657"
7441,"սասունցի դավթի փողոց 13, երևան","Armenia, Yerevan, Sasuntsi Davit Street, 13","40.15521,44.514873"
7449,"նաիրի զարյան փողոց 74b, երևան","Armenia, Yerevan, Nairi Zaryan Street, 74B","40.203573,44.517092"
7461,"մհեր մկրտչյան փողոց 1, երևան","Armenia, Yerevan, Mher Mkrtchyan Street, 1","40.174486,44.510669"
7467,"աճառյան փողոց 44, երևան","Armenia, Yerevan, Acharyan Street, 44","40.226995,44.55863"
7475,"улица абовяна, ереван","Armenia, Yerevan, Abovyan Street","40.184787,44.520137"
7508,"ամիրյան փողոց 18, yerevan","Armenia, Yerevan, Amiryan Street, 18","40.181756,44.506896"
7515,"շիրակ փողոցի 5-րդ նրբանցք, 1/1ա, երևան","Armenia, Yerevan, Shirak Street 5th Lane, 1/1A","40.139706,44.434016"
7532,"նելսոն ստեփանյան փողոց 3/6, երևան","Armenia, Yerevan, Nelson Stepanyan Street, 3/6","40.199957,44.569823"
7575,"մամիկոնյանց փողոց 45, երևան","Armenia, Yerevan, Mamikonyants Street, 45","40.209228,44.509079"
7577,"դավթաշեն 1-ին թաղամաս 32, երևան","Armenia, Yerevan, The Administrative District of Davtashen, Davtashen 1st Block, 32","40.223284,44.489307"
7584,"տարոնցի փողոցի 1-ին նրբանցք 1, երևան","Armenia, Yerevan, Taronts Street 1st Lane, 1","40.144752,44.483019"
7586,"շոպրոնի 1-ին նրբանցք 3, երևան","Armenia, Yerevan, 1st Street 10 alley","40.143436,44.543206"
7589,"ադոնցի փողոց 2, երևան","Armenia, Yerevan, Adonts Street, 2","40.21053,44.528734"
7616,"լեփսիուսի փողոց 8, երևան","Armenia, Yerevan, Lepsius Street, 8","40.208808,44.544499"
7621,"улица багратуняц 11а, ереван","Armenia, Yerevan, Bagratunyats Street, 11A","40.153604,44.480459"
7624,"արաբկիր 51 փողոց, երևան","Armenia, Yerevan, Vahagn Davtyan Street, 51","40.203008,44.509528"
7625,"ադոնցի փողոց 19/4, երևան","Armenia, Yerevan, Adonts Street, 19/4","40.213512,44.51888"
7637,"քեռու փողոց 35, երևան","Armenia, Yerevan, Qeri Street, 35","40.199764,44.486298"
7642,"malkhasyants street, yerevan","Armenia, Yerevan, Malkhasyants Street","40.211067,44.507785"
7647,"կոմիտասի պողոտա 59/7, երևան","Armenia, Yerevan, Komitas Avenue, 59/7","40.207003,44.521098"
7651,"19-я улица арабкира, ереван","Armenia, Yerevan, Davit Hovhannes Street","40.201913,44.508154"
7661,"zoravar andranik street, երևան","Armenia, Yerevan, Zoravar Andranik Street","40.175162,44.44573"
7676,"կուրղինյան փողոցի նրբանցք 10ա, երևան",,
7680,"tumanyan street, երևան","Armenia, Yerevan, Tumanyan Street","40.182996,44.516589"
7684,"դավթաշենի 10-րդ փողոց, երևան","Armenia, Yerevan, Davtashen 10th Street","40.219193,44.482588"
7700,"արշակունյաց պողոտա, yerevan","Armenia, Yerevan, Arshakunyats Avenue","40.148909,44.497751"
7703,"սասունցի դավթի փողոց, երևան","Armenia, Yerevan, Sasuntsi Davit Street","40.154741,44.516634"
7737,"աջափնյակ վարչական շրջան , երևան","Armenia, Yerevan, The Administrative District of Ajapnyak","40.200439,44.461845"
7740,"հաղթանակի 2-րդ փողոց 12, երևան","Armenia, Yerevan, Haghtanak 2nd Street, 12","40.184243,44.428204"
7742,"բաղյան փողոցի 1-ին նրբանցք, երևան","Armenia, Yerevan, Baghyan Street 1st Lane","40.193819,44.567595"
7758,"լեոյի փողոց 1, երևան","Armenia, Yerevan, Leo Street, 1","40.180626,44.504471"
7774,"վերին անտառային փողոց 17/1, երևան","Armenia, Yerevan, Verin Antarayin Street, 17/1","40.196409,44.510184"
7784,"կորյունի փողոց 1-ին նրբանցք, երևան","Armenia, Yerevan, The Administrative District of Malatia-Sebastia, Nor Yerevan Residential Complex","40.16519,44.436684"
7785,"սունդուկյան փողոց 10, երևան","Armenia, Yerevan, Sundukyan Street, 10","40.197167,44.495011"
7786,"նաիրի զարյան փողոց 15, երևան","Armenia, Yerevan, Nairi Zaryan Street, 15","40.204703,44.511531"
7788,"հունան ավետիսյանի փողոց, երևան","Armenia, Yerevan, Minas Avetisyan 4th Street","40.205819,44.545254"
7797,"ագաթանգեղոսի փողոց 7, երևան","Armenia, Yerevan, Agatangeghos Street, 7","40.173081,44.512322"
7815,"վարդաշենի 9-րդ փողոց 74/2, երևան","Armenia, Yerevan, Vardashen 9th Street, 74/2","40.149323,44.54485"
7819,"զորավար անդրանիկի բ2 թաղամաս, երևան","Armenia, Yerevan, The Administrative District of Malatia-Sebastia, Zoravar Andranik District","40.174135,44.445864"
7826,"նիզամու փողոց 1, երևան","Armenia, Yerevan, Nizami Street, 1","40.153935,44.48813"
7829,"անդրանիկ իոսիֆյան փողոց 7/1, երևան","Armenia, Yerevan, Andranik Iosifyan Street, 7/1","40.212672,44.481716"
7846,"mantashyan street lane 4/5, yerevan","Armenia, Yerevan, Mantashyan Street Lane, 6","40.15015,44.490708"
7850,"բաշինջաղյան փողոցի 1-ին նրբանցք 24, երևան","Armenia, Yerevan, Bashinjaghyan Street 1st Lane, 24","40.205054,44.465457"
7857,"շինարարների փողոց 4, երևան","Armenia, Yerevan, Shinararner Street, 4","40.1928,44.474395"
7862,"արցախի պողոտա , երևան","Armenia, Yerevan, Artsakh Avenue","40.1355,44.510229"
7877,"մարգարյան փողոց 14, երևան","Armenia, Yerevan, Margaryan Street, 14","40.205006,44.473533"
7880,"եղիշե թադևոսյան փողոց 14, երևան","Armenia, Yerevan, Yeghishe Tadevosyan Street, 14","40.14398,44.487663"
7888,"մազմանյան փողոց 5/1, երևան","Armenia, Yerevan, Mazmanyan Street, 5/1","40.211542,44.467343"
7898,"աճառյան փողոց 37/1, երևան","Armenia, Yerevan, Acharyan Street, 37/1","40.229852,44.556456"
7905,"արմեն գուլակյան փողոց , երևան","Armenia, Yerevan, Armen Gulakyan Street","40.196947,44.501919"
7918,"սարի թաղ 13-րդ փողոց նրբանցք, երևան","Armenia, Yerevan, Sari Tagh 13th Street Lane","40.164204,44.529507"
7919,"տիգրան մեծի պողոտա 29, երևան","Armenia, Yerevan, Tigran Mets Avenue, 29","40.169587,44.513804"
7926,"բաղրամյան պողոտա 42, երևան","Armenia, Yerevan, Baghramyan Avenue, 42","40.192724,44.503761"
7927,"հովսեփ էմինի փողոց 7, երևան","Armenia, Yerevan, Hovsep Emin Street, 7","40.204751,44.49167"
7938,"մանանդյանի փողոց 34, երևան","Armenia, Yerevan, Shirak Street, 34","40.147062,44.4603"
7939,"արշակունյաց պողոտա 50/2, երևան","Armenia, Yerevan, Arshakunyats Avenue, 50/2","40.147668,44.496062"
7943,"nalbandyan street, երևան","Armenia, Yerevan, Nalbandyan Street","40.18148,44.519787"
7949,"սերո խանզադյան 1-ին նրբ, երևան","Armenia, Yerevan, Sero Khanzadyan Street","40.192228,44.537097"
7952,"շարուրի փողոց 33, երևան","Armenia, Yerevan, Sharuri Street, 33","40.139465,44.462178"
7955,"մինսկի փողոց 16, երևան","Armenia, Yerevan, Minsk Street, 16","40.173811,44.573856"
7969,"սողոմոն տարոնցի փողոց 5, երևան","Armenia, Yerevan, Soghomon Taronts Street, 5","40.145952,44.485741"
7980,"շահումյան 1֊ին փողոց, երևան","Armenia, Yerevan, Shahumyan 1st Street 1st Lane","40.166554,44.462816"
7982,"ալեքսանդր սպենդիարյանի փողոց, երևան","Armenia, Yerevan, Spendiaryan Street","40.187392,44.512358"
7995,"ղափանցյան փողոց 9, երևան","Armenia, Yerevan, Ghapantsyan Street, 9","40.21752,44.524826"
8000,"սամվել գևորգյան փողոց, երևան","Armenia, Yerevan, The Administrative District of Davtashen, Samvel Gevorgyan Street","40.218353,44.470963"
8002,"չեխովի փողոց 27, երևան","Armenia, Yerevan, Chekhov Street, 27","40.150722,44.477961"
8009,"սիսվանի փողոց, երևան","Armenia, Yerevan, Sisvan Street","40.177387,44.493322"
8016,"արշակունյաց պողոտա 2, երևան","Armenia, Yerevan, Arshakunyats Avenue, 2","40.171013,44.507866"
8026,"շիրազի փողոց 22, երևան","Armenia, Yerevan, Shiraz Street, 22","40.204579,44.462375"
8029,"շիրակի փողոց 1, երևան","Armenia, Yerevan, Shirak Street, շ1","40.146021,44.462349"
8032,"հյուսիսային պողոտա 6, երևան","Armenia, Yerevan, Northern Avenue, 6","40.183492,44.514514"
8036,"մովսես խորենացու փողոց 47/1, երևան","Armenia, Yerevan, Khorenatsi Street, 47/1","40.164232,44.517119"
8041,"վահրամ փափազյանի 2-րդ նրբանցք 118/1, երևան","Armenia, Yerevan, Sose Street 2nd Lane","40.19435,44.504228"
8046,"նվեր սաֆարյան փողոց, երևան","Armenia, Yerevan, Nver Safaryan Street","40.211459,44.581294"
8068,"սարյանի փողոց 18, երևան","Armenia, Yerevan, Saryan Street, 18","40.185545,44.506851"
8069,"գերցենի փողոց, երևան","Armenia, Yerevan, Gertsen Street","40.202333,44.551408"
8070,"նորաշեն թաղամաս 19, երևան","Armenia, Yerevan, The Administrative District of Ajapnyak, Norashen Quarter, 19","40.215406,44.46799"
8073,"դուրյան թաղամաս 29, երևան","Armenia, Yerevan, The Administrative District of Avan, Duryan District, 29","40.213822,44.583064"
8081,"ներքին շենգավիթ 9-րդ փողոց 1, երևան","Armenia, Yerevan, Shahamiryanner Street, 1","40.142567,44.481294"
8082,"եղիազարյան փողոց, երևան","Armenia, Yerevan, Yeghiazaryan Street","40.197629,44.469823"
