id,Address,found_address,coordinates
11967,"մամիկոնյանց փողոց 25, երևան","Armenia, Yerevan, Mamikonyants Street, 25","40.208932,44.520964"
11982,"улица московян 8, ереван","Armenia, Yerevan, Moskovyan Street, 8","40.188542,44.517972"
11986,"անաստաս միկոյան փողոց , երևան","Armenia, Yerevan, Anastas Mikoyan Street","40.221059,44.502036"
11991,"առնո բաբաջանյան փողոց 7, երևան","Armenia, Yerevan, Arno Babajanyan Street, 7","40.17142,44.438741"
12000,"շիրակի փողոց 6a, երևան","Armenia, Yerevan, Shirak Street, 6A","40.14205,44.466454"
12005,"դավթաշեն 3-րդ թաղամաս 11/5, երևան","Armenia, Yerevan, The Administrative District of Davtashen, Davtashen 3rd Block, 11/5","40.216549,44.488768"
12016,"նիկողայոս տիգրանյան փողոց 14, երևան","Armenia, Yerevan, Nikoghayos Tigranyan Street, 14","40.211549,44.520973"
12024,"շիրակի 2-րդ նրբանցք, երևան","Armenia, Yerevan, Norq Street Street 2nd Lane","40.189844,44.541724"
12032,"zaqyan street, yerevan","Armenia, Yerevan, Zaqyan Street","40.177325,44.507372"
12048,"ավանի 6-րդ փողոցի 2-րդ նրբանցք, երևան","Armenia, Yerevan, High Park Yerevan Residential Complex","40.222216,44.551443"
12058,"լյուքսեմբուրգ փողոցի 1-ին նրբանցք 5, երևան","Armenia, Yerevan, Lyuksemburg Street 1st Lane, 5","40.188453,44.563005"
12059,"գարեգին հովսեփյան փողոց 38/6, երևան","Armenia, Yerevan, Garegin Hovsepyan Street, 38/6","40.180364,44.535085"
12062,"քաջազնունու փողոց 6, երևան","Armenia, Yerevan, Kajaznuni Street, 6","40.169807,44.518924"
12063,"խաղաղ դոնի փողոց 23/3, երևան","Armenia, Yerevan, Khaghagh Doni Street, 23/3","40.126591,44.527"
12069,"դավթաշենի 1-ին փողոց 7, երևան","Armenia, Yerevan, Davtashen 1st Street, 7","40.214283,44.478383"
12070,"մարշալ բաբաջանյան փողոց 72, երևան","Armenia, Yerevan, Marshal Babajanyan Street, 72","40.220281,44.578653"
12073,"բագրատունյաց փողոց 49, երևան","Armenia, Yerevan, Bagratunyats Street, 49","40.144573,44.492703"
12077,"վրացական փողոց 21/1, երևան","Armenia, Yerevan, Vratsakan Street, 21/1","40.209063,44.510516"
12080,"avet avetisyan street 60/2, yerevan","Armenia, Yerevan, Avet Avetisyan Street, 60/2","40.197753,44.500096"
12081,"աերացիա թաղամաս, երևան","Armenia, Yerevan, The Administrative District of Shengavit, Aeracia district","40.140154,44.436127"
12096,"սեբաստիայի փողոց 3/3, երևան","Armenia, Yerevan, Sebastia Street, 3/3B","40.188425,44.462852"
12099,"սայաթ-նովա թաղամաս 8/1, երևան","Armenia, Yerevan, The Administrative District of Avan, Sayat-Nova District, 8/1","40.216638,44.582543"
12101,"առնո բաբաջանյան փողոց 98/4, երևան","Armenia, Yerevan, Arno Babajanyan Street, 98/4","40.166093,44.438678"
12110,"բակունցի փողոց 2, երևան","Armenia, Yerevan, Bakunts Street, 2","40.192214,44.572401"
12111,"գյուլբենկյան փողոց 23, երևան","Armenia, Yerevan, Gyulbenkyan Street, 23","40.19747,44.497571"
12114,"մելիք մելիքյան փողոցի նրբանցք 17, երևան","Armenia, Yerevan, Meliq Meliqyan Street Lane, 17","40.230513,44.54785"
12125,"ռուբինյանց փողոց 9, երևան","Armenia, Yerevan, Rubinyants Street, 9","40.201307,44.542326"
12137,"վիլնյուսի փողոց 61, երևան","Armenia, Yerevan, Vilnius Street, 61","40.171806,44.567173"
12138,"կոմիտասի պողոտա 1/11, երևան","Armenia, Yerevan, Komitas Avenue, 1/11","40.201865,44.493852"
12141,"ավան-առինջ 2-րդ միկրոշրջան 1/13, երևան","Armenia, Yerevan, The Administrative District of Avan, Avan-Arinj 2nd microdistrict, 1/13","40.224454,44.571943"
12143,"արաբկիրի 19-րդ փողոց 6, երևան","Armenia, Yerevan, Davit Hovhannes Street, 6","40.201569,44.507435"
12145,"ֆրիկի փողոց 2, երևան","Armenia, Yerevan, Frik Street, 2","40.185841,44.505504"
12146,"նիկողայոս տիգրանյան փողոց 6, երևան","Armenia, Yerevan, Nikoghayos Tigranyan Street, 6","40.207857,44.520622"
12190,"վերին շենգավիթի 2-րդ փողոց 20/1, երևան","Armenia, Yerevan, Verin Shengavit 2nd Street, 20/1","40.154348,44.493754"
12199,"nansen st, yerevan","Armenia, Yerevan, Nansen Street","40.198579,44.561514"
12238,"սարյան փողոց 29, երևան","Armenia, Yerevan, Saryan Street, 29","40.181818,44.505171"
12244,"տիգրան պետրոսյան փողոց 37, երևան","Armenia, Yerevan, Tigran Petrosyan Street, 37","40.221411,44.493161"
12254,"զավարյան փողոց 57/19, երևան","Armenia, Yerevan, Zavaryan Street, 57/19","40.168002,44.517002"
12279,"էզրաս հասրաթյան փողոց, երևան","Armenia, Yerevan, Ezras Hasratyan Street","40.21261,44.537564"
12314,"մուրացանի փողոց 109, երևան","Armenia, Yerevan, Muratsan Street, 109","40.151315,44.516912"
12315,"улица грачья кочара, ереван","Armenia, Yerevan, Hrachya Kochar Street","40.201348,44.501821"
12316,"գյուլիքևխյան փողոց 3, երևան","Armenia, Yerevan, Gyulikevkhyan Street, 3","40.190106,44.568556"
12319,"մաշտոցի պողոտա 34, երևան","Armenia, Yerevan, Mashtots Avenue, 34","40.183251,44.510885"
12324,"երվանդ քոչարի փողոց 17, երևան","Armenia, Yerevan, Yervand Kochar Street, 17","40.170331,44.517451"
12338,"բագրատունյաց փողոց 18, երևան","Armenia, Yerevan, Bagratunyats Street, 18","40.150281,44.483549"
12345,"քաջազնունու փողոց 9, երևան","Armenia, Yerevan, Kajaznuni Street, 9","40.16887,44.520496"
12358,"կոմիտասի պողոտա 57, երևան","Armenia, Yerevan, Komitas Avenue, 57","40.20668,44.520568"
12372,"գյուլբենկյան փողոց 35/1, երևան","Armenia, Yerevan, Gyulbenkyan Street, 35/1","40.201962,44.494463"
12373,"խորենացու փողոց 49, երևան","Armenia, Yerevan, Khorenatsi Street, 49","40.163095,44.517568"
12383,"շինարարների փողոց 28, երևան","Armenia, Yerevan, Shinararner Street, 28","40.198139,44.475105"
12394,"մխիթար հերացի փողոց 22, երևան","Armenia, Yerevan, Shirak Street, 22","40.145662,44.461307"
12401,"հանրապետության փողոց 51/53, երևան","Armenia, Yerevan, Hanrapetutyan Street, 51","40.176753,44.515825"
12409,"արգիշտի փողոց 11/4, երևան","Armenia, Yerevan, Argishti Street, 11/4","40.172054,44.502988"
12410,"օհան դուրյան փողոց 11/8, երևան","Armenia, Yerevan, Duryan Street, 11/8","40.189135,44.545164"
12448,"մարտիրոս սարյանի փողոց, երևան","Armenia, Yerevan, Saryan Street","40.184877,44.506339"
12449,"գյուլբենկյան փողոց 46, երևան","Armenia, Yerevan, Gyulbenkyan Street, 46","40.205082,44.493439"
12452,"բանավան թաղամաս 5, երևան","Armenia, Yerevan, The Administrative District of Nor Nork, Banavan District, 5","40.188418,44.592182"
12477,"paruyr sevak street 5/3, yerevan","Armenia, Yerevan, Paruyr Sevak Street, 5/3","40.20949,44.536019"
12492,"մարշալ բաղրամյան պողոտայի 3-րդ նրբանցք 3, երևան","Armenia, Yerevan, Marshal Baghramyan Avenue 3rd Lane, 3","40.195659,44.492936"
12494,"tamanyan street, yerevan","Armenia, Yerevan, Tamanyan Street","40.189279,44.515152"
12498,"առնո բաբաջանյան փողոց 54, երևան","Armenia, Yerevan, Arno Babajanyan Street, 54","40.169407,44.437465"
12499,"էրեբունու փողոց 32, երևան","Armenia, Yerevan, Erebuni Street, 32","40.141161,44.530028"
12519,"ավան-առինջ 2-րդ միկրոշրջան 2/3, երևան","Armenia, Yerevan, The Administrative District of Avan, Avan-Arinj 2nd microdistrict, 2/3","40.22475,44.574656"
12527,"շիրակի փողոց 8, երևան","Armenia, Yerevan, Shirak Street, 8","40.142167,44.465897"
12528,"քաջազնունու փողոց 8, երևան","Armenia, Yerevan, Kajaznuni Street, 8","40.169297,44.519158"
12547,"եղիշե թադևոսյան փողոց 4, երևան","Armenia, Yerevan, Yeghishe Tadevosyan Street, 4","40.1474,44.491113"
12583,"հովհաննես հովհաննիսյանի փողոց 119, երևան","Armenia, Yerevan, Hovhannes Hovhannisyan Street, 119","40.150584,44.454021"
12587,"տիգրան պետրոսյան փողոց 49, երևան","Armenia, Yerevan, Tigran Petrosyan Street, 51/1","40.218876,44.489747"
12590,"զավարյան փողոց 29, երևան","Armenia, Yerevan, Zavaryan Street, 29","40.166616,44.512537"
12615,"առնո բաբաջանյան փողոց 5/1, երևան","Armenia, Yerevan, Arno Babajanyan Street, 5/1","40.171323,44.437753"
12633,"artashisyan street, yerevan","Armenia, Yerevan, Artashisyan Street","40.146669,44.46569"
12639,"արամի փողոց 76, երևան","Armenia, Yerevan, Aram Street, 76","40.183837,44.507911"
12646,"թևոսյան փողոց 3/1, երևան","Armenia, Yerevan, Tevosyan Street, 3/1","40.185352,44.575617"
12660,"մառի փողոց նրբանցք, երևան","Armenia, Yerevan, Mar Street","40.185228,44.568017"
12665,"ակսել բակունց փողոցի 1-ին նրբանցք 4, երևան","Armenia, Yerevan, Aksel Bakunts Street 1st Lane, 4","40.191105,44.574063"
12678,"varlam avanesov street 8, yerevan","Armenia, Yerevan, Avanesov Street, 8","40.131508,44.528186"
12688,"նար-դոսի փողոց 1, երևան","Armenia, Yerevan, Nar-Dos Street, 1","40.165548,44.511226"
12692,"թբիլիսյան խճուղու անցուղի, երևան","Armenia, Yerevan, Tbilisyan Highway Lane","40.225542,44.538175"
12698,"գայի պողոտա 10, երևան","Armenia, Yerevan, Gai Avenue, 10","40.201466,44.564478"
12699,"այգեստան 11-րդ փողոց 7/7, երևան","Armenia, Yerevan, Gevorg Jahukyan Street, 9","40.182004,44.529974"
12712,"տիգրան մեծի պողոտա 1, երևան","Armenia, Yerevan, Tigran Mets Avenue, 1","40.175479,44.514109"
12719,"գալշոյան փողոց 36, երևան","Armenia, Yerevan, Galshoyan Street, 36","40.179241,44.56649"
12720,"արտաշիսյան փողոց 62, երևան","Armenia, Yerevan, Artashisyan Street, 62","40.147813,44.467631"
12721,"վահրամ փափազյան փողոց 23, երևան","Armenia, Yerevan, Vahram Papazyan Street, 23","40.205826,44.500832"
12727,"զաքարիա քանաքեռցու փողոց 72, երևան","Armenia, Yerevan, Zakaria Kanakertsi Street, 72","40.224854,44.547653"
12733,"մամիկոնյանց փողոց 49/1, երևան","Armenia, Yerevan, Mamikonyants Street, 49/1","40.209063,44.50774"
12736,"օրբելի եղբայրների փողոց 4, երևան","Armenia, Yerevan, Orbeli Brothers Street, 4","40.194494,44.49493"
12742,"միքայել չայլախյան փողոց 69, երևան","Armenia, Yerevan, Mikhail Chailakhyan Street, 69","40.18086,44.529785"
12749,"davtashen 4-th block, yerevan","Armenia, Yerevan, The Administrative District of Davtashen, Davtashen 4th Block, 4","40.22203,44.497068"
12764,"գարեգին նժդեհի փողոց 8, երևան","Armenia, Yerevan, Garegin Nzhdeh Street, 8","40.150998,44.486882"
12767,"monte melkonyan avenue, yerevan","Armenia, Yerevan, Monte Melkonyan Street","40.178255,44.480521"
12770,"միքայել մազմանյանի փողոց, երևան","Armenia, Yerevan, Mazmanyan Street","40.208959,44.465259"
12771,"մայիսի 9-ի փողոց 13, երևան","Armenia, Yerevan, May 9th Street, 13","40.154079,44.489756"
12777,"վիլնյուսի փողոց 67, երևան","Armenia, Yerevan, Vilnius Street, 67","40.171309,44.56216"
12781,"արցախի պողոտա 1, երևան","Armenia, Yerevan, Artsakh Avenue, 1","40.15419,44.510498"
12790,"շոպրոն փողոցի 1-ին նրբանցք, երևան","Armenia, Yerevan, Shopron Street 1st Lane","40.186158,44.562133"
12791,"տերյան փողոց 69, երևան","Armenia, Yerevan, Teryan Street, 69","40.186406,44.518457"
12792,"արզումանյան փողոց , երևան","Armenia, Yerevan, Arzumanyan Street","40.193137,44.473497"
12802,"nersisyan st, yerevan","Armenia, Yerevan, Levon Nersisyan Street","40.206012,44.531582"
12810,"նազարբեկյան թաղամաս 2, երևան","Armenia, Yerevan, The Administrative District of Ajapnyak, Nazarbekyan Quarter, 2","40.210433,44.458216"
12825,"նորքի այգիներ փողոց 227, երևան","Armenia, Yerevan, Norki Ayginer Street, 227","40.184904,44.53672"
12831,"վաղարշյան փողոց 15b, երևան","Armenia, Yerevan, Vagharshyan Street, 15B","40.201493,44.49882"
12848,"էրեբունու փողոց 1, երևան","Armenia, Yerevan, Erebuni Street, 1","40.142974,44.51181"
12853,"սվաճյան փողոց 38/1, երևան","Armenia, Yerevan, Svachyan Street, 38/1","40.17492,44.442729"
12857,"մառի փողոց նրբանցք 4, երևան","Armenia, Yerevan, Mar Street, 4","40.185518,44.56543"
12859,"մարիա յակոբսեն փողոց 9a, երևան","Armenia, Yerevan, Maria Jacobsen Street, 9A","40.20192,44.519068"
12867,"վիլնյուսի փողոց 19, երևան","Armenia, Yerevan, Vilnius Street, 19","40.172329,44.568161"
12880,"մազմանյան փողոց 5, երևան","Armenia, Yerevan, Mazmanyan Street, 5","40.209448,44.467343"
12888,"անաստաս միկոյան փողոց 25, երևան","Armenia, Yerevan, Anastas Mikoyan Street, 25","40.216494,44.494661"
12900,"ամիրյան փողոց 15/2, երևան","Armenia, Yerevan, Amiryan Street, 15/2","40.181087,44.507291"
12903,"չեխովի փողոց 12, երևան","Armenia, Yerevan, Chekhov Street, 12","40.155527,44.483378"
12905,"մինսկի փողոց 34, երևան","Armenia, Yerevan, Minsk Street, 34","40.173714,44.569365"
12906,"ներքին շենգավիթի 9-րդ փողոց , երևան","Armenia, Yerevan, Nerkin Shengavit 9th Street","40.140637,44.48098"
12908,"սիլվա կապուտիկյանի փողոց, երևան","Armenia, Yerevan, 1-ya ulitsa","40.222836,44.482794"
12918,"մոլդովական փողոց 39/37, երևան","Armenia, Yerevan, Moldovakan Street, 39/37","40.202141,44.577971"
12921,"կոմիտասի պողոտա, 1-ին նրբանցք, երևան","Armenia, Yerevan, Komitas Avenue 1st Lane","40.207933,44.514442"
12939,"լենինգրադյան փողոց , երևան","Armenia, Yerevan, Kirk Kerkorian Street","40.191236,44.471044"
12944,"ագաթանգեղոսի փողոց 3, երևան","Armenia, Yerevan, Agatangeghos Street, 3","40.172288,44.51075"
12954,"անաստաս միկոյանի փողոց 6, երևան","Armenia, Yerevan, Tigran Mets Avenue, 6","40.175237,44.513588"
12957,"վարդանանց փողոցի 2-րդ նրբանցք, երևան","Armenia, Yerevan, Vardananc Street 2nd Lane","40.176932,44.520793"
12990,"արտաշես քալանթարյան փողոց 133, երևան","Armenia, Yerevan, Artashes Kalantaryan Street, 133","40.165851,44.44891"
12994,"տիչինա փողոցի 3-րդ նրբանցք 24/2, երևան","Armenia, Yerevan, Tichina Street 3rd Lane, 24/2","40.18673,44.453689"
12996,"արցախի պողոտա 8/2, երևան","Armenia, Yerevan, Artsakh Avenue, 8/2","40.151095,44.509429"
13005,"մինսկի փողոց 2, երևան","Armenia, Yerevan, Minsk Street, 2","40.175961,44.571925"
13010,"արցախի պողոտա 17, երևան","Armenia, Yerevan, Artsakh Avenue, 17","40.149178,44.510355"
13011,"ալեք մանուկյանի փողոց 8/1, երևան","Armenia, Yerevan, Aram Manukyan Street, 8","40.170613,44.454363"
13012,"vratsakan street 16/3, yerevan","Armenia, Yerevan, Vratsakan Street, 16/3","40.208174,44.512223"
13016,"կարախանյան փողոց 21, երևան","Armenia, Yerevan, Karakhanyan Street, 21","40.178359,44.56305"
13038,"թումանյան փողոց 27, երևան","Armenia, Yerevan, Tumanyan Street, 27","40.184932,44.513562"
13041,"հաղթանակ թաղամաս 64/4, երևան","Armenia, Yerevan, The Administrative District of Malatia-Sebastia, Haghtanak District, 64/4","40.179751,44.435705"
13054,"եղիշե թադևոսյան փողոց 2, երևան","Armenia, Yerevan, Yeghishe Tadevosyan Street, 2","40.147703,44.491508"
13061,"մասիսի փողոց 99/3, երևան","Armenia, Yerevan, Masis Street, 99/3","40.144952,44.507651"
13062,"էրեբունու փողոց 15/3, երևան","Armenia, Yerevan, Erebuni Street, 15/3B","40.143387,44.519454"
13082,"բնակելի համալիր լույսեր, երևան","Armenia, Yerevan, Luyser Residential Complex","40.188115,44.47064"
13086,"ազատամարտիկների պողոտա 87, երևան","Armenia, Yerevan, The Administrative District of Erebuni, Azatamartikner Avenue, 87","40.143298,44.522302"
13094,"նորաշեն թաղամաս 4, երևան","Armenia, Yerevan, The Administrative District of Ajapnyak, Norashen Quarter, 4","40.211163,44.465484"
13095,"ծիծեռնակաբերդի խճուղի 55, երևան","Armenia, Yerevan, Tsitsernakaberd Highway","40.181652,44.484833"
13096,"կոմիտասի պողոտա 51/1, երևան","Armenia, Yerevan, Komitas Avenue, 51/1","40.207465,44.518376"
13117,"տիգրան պետրոսյան փողոց 11/2, երևան","Armenia, Yerevan, Tigran Petrosyan Street, 11/2","40.221961,44.494841"
13134,"marshal khudyakov street, yerevan","Armenia, Yerevan, Marshal Khudyakov Street","40.212906,44.57206"
13138,"նար-դոսի փողոց 77, երևան","Armenia, Yerevan, Nar-Dos Street, 77","40.167402,44.521125"
13142,"կարապետ ուլնեցու փողոց 58/10ա, երևան","Armenia, Yerevan, Karapet Ulnetsi Street, 58/10B","40.19787,44.535948"
13159,"shiraki st, yerevan","Armenia, Yerevan, Shirak Street","40.142836,44.46454"
13166,"հին երևանցու փողոց 47a, երևան","Armenia, Yerevan, Hin Yerevantsu Street, 47A","40.184298,44.512915"
13168,"պարույր սևակի փողոց 52/1, երևան","Armenia, Yerevan, Paruyr Sevak Street, 52/1","40.205089,44.53911"
13171,"հրաչյա ներսիսյան փողոց 14/1, երևան","Armenia, Yerevan, Hrachya Nersisyan Street, 14/1","40.204813,44.530791"
13190,"2-я улица верин шенгавита, ереван","Armenia, Yerevan, Verin Shengavit 2nd Street","40.154072,44.492945"
13191,"հովսեփ արղության փողոց 22, երևան","Armenia, Yerevan,  Atlantis Yerevan Residential Complex","40.212059,44.50615"
13215,"դավթաշեն 3-րդ թաղամաս 7/29, երևան","Armenia, Yerevan, The Administrative District of Davtashen, Davtashen 3rd Block, 7/29","40.214896,44.492694"
13235,"խորենացու փողոց 9, երևան","Armenia, Yerevan, Khorenatsi Street, 9","40.178049,44.507372"
13247,"վաղարշյան փողոց 18ա, երևան","Armenia, Yerevan, Vagharshyan Street, 18A","40.201769,44.5005"
13253,"փոքր կենտրոն թաղամաս, երևան","Armenia, Yerevan, The Administrative District of Kentron, Poqr Kentron District","40.182321,44.514586"
13263,"բագրևանդի փողոց 16, երևան","Armenia, Yerevan, Bagrevand Street, 16","40.199337,44.581285"
13272,"հանրապետության փողոց 78, երևան","Armenia, Yerevan, Hanrapetutyan Street, 78","40.178938,44.521817"
13273,"улица армена тиграняна 6/3, ереван","Armenia, Yerevan, Armen Tigranyan Street, 6","40.200136,44.522778"
13316,"պարույր սևակի փողոց 1/7, երևան","Armenia, Yerevan, Paruyr Sevak Street, 1/7","40.212506,44.533621"
13317,"չեխովի փողոց 49, երևան","Armenia, Yerevan, Chekhov Street, 47","40.149185,44.473083"
13344,"բագրատունյաց պողոտա 40/1, երևան","Armenia, Yerevan, Komitas Avenue, 40/1","40.205529,44.508208"
13346,"մամիկոնյանց փողոց, 1-ին նրբանցք 1, երևան","Armenia, Yerevan, Mamikonyants Street 1st Lane, 1","40.210302,44.508729"
13363,"բրյուսովի փողոց 165, երևան","Armenia, Yerevan, Bryusov Street, 165","40.16641,44.502467"
13390,"tsovakal isakov avenue, yerevan","Armenia, Yerevan, Tsovakal Isakov Avenue","40.157229,44.459896"
13415,"դավթաշենի 4-րդ զանգված 2a, երևան","Armenia, Yerevan, Davtashen 4th Street, 2","40.214207,44.477377"
13426,"վրացական 4 նրբանցք, երևան","Armenia, Yerevan, Vratsakan Street 2nd Lane, 4","40.205846,44.51145"
13447,"սիլվա կապուտիկյան փողոց, երևան","Armenia, Yerevan, Silva Kaputikyan Street","40.193062,44.507336"
13460,"դավիթ հովհաննեսի փողոց 4, երևան","Armenia, Yerevan, Davit Hovhannes Street, 4","40.20139,44.506851"
13474,"նուբարաշենի 11-րդ փողոց 12, երևան","Armenia, Yerevan, Nubarashen 11th Street, 12","40.082251,44.544311"
13485,"գյուլիքևխյան փողոց 4, երևան","Armenia, Yerevan, Gyulikevkhyan Street, 4","40.189362,44.568116"
13502,"սարյանի փողոց 22, երևան","Armenia, Yerevan, Saryan Street, 22","40.184822,44.505513"
13503,"moldovakan street 29/4, երևան","Armenia, Yerevan, Moldovakan Street, 29/4","40.207596,44.571359"
13527,"այգեստանի 10րդ փողոց, երևան","Armenia, Yerevan, Nubarashen 11th Street, 10","40.082554,44.54467"
13554,"проспект маршала баграмяна 85, yerevan","Armenia, Yerevan, Baghramyan Avenue, 85","40.196465,44.49334"
13559,"կարապետ ուլնեցու փողոց 58/20, երևան","Armenia, Yerevan, Karapet Ulnetsi Street, 58/20B","40.198559,44.534214"
13560,"ազատության պողոտա 12/1, երևան","Armenia, Yerevan, Azatutyan Avenue, 12/1","40.203098,44.524153"
13566,"արգիշտիի փողոց 11/4, երևան","Armenia, Yerevan, Argishti Street, 11/4","40.172054,44.502988"
13568,"ֆուչիկի փողոց 6, երևան","Armenia, Yerevan, Fuchik Street, 6","40.201769,44.477818"
13570,"ռաֆայել իսրաելյան փողոց 43, երևան","Armenia, Yerevan, Rafael Israyelyan Street, 43","40.179089,44.500374"
13573,"ավան-առինջ 2-րդ միկրոշրջան 2/8, երևան","Armenia, Yerevan, The Administrative District of Avan, Avan-Arinj 2nd microdistrict, 2/8","40.225639,44.573174"
13578,"david-bek street 290, երևան","Armenia, Yerevan, David-Bek Street, 290","40.184443,44.56367"
13579,"վարդան աճեմյան փողոց, երևան","Armenia, Yerevan, Alexander Achemyan Street","40.211322,44.438642"
13584,"կոմիտասի պողոտա 27/1, երևան","Armenia, Yerevan, Komitas Avenue, 27/1","40.205908,44.504695"
13590,"արգիշտիի փողոց 11/11, երևան","Armenia, Yerevan, Argishti Street, 11/11","40.171482,44.502899"
13595,"davidashen 2-nd street, yerevan","Armenia, Yerevan, 2nd Street","40.226699,44.490026"
13599,"շոպրոնի 1-ին նրբանցք, երևան","Armenia, Yerevan, 1st Street 10 alley","40.143436,44.543206"
13600,"ծարավ աղբյուրի փողոց 55/17, երևան","Armenia, Yerevan, Tsarav Akhpyur Street, 55/17","40.21887,44.54953"
13601,"ղազարոս աղայան փողոց 15, երևան","Armenia, Yerevan, Ghazaros Aghayan Street, 15","40.185476,44.519041"
13609,"շիրակի փողոցի 5-րդ նրբանցք 1/1a, երևան","Armenia, Yerevan, Shirak Street 5th Lane, 1/1A","40.139706,44.434016"
13613,"պուշկինի փողոց 3/1, երևան","Armenia, Yerevan, Pushkin Street, 3/1","40.179999,44.515798"
13616,"նորաշեն թաղամաս 16, երևան","Armenia, Yerevan, The Administrative District of Ajapnyak, Norashen Quarter, 16","40.215061,44.466912"
13621,"զորավար անդրանիկի փողոց 115/2, երևան","Armenia, Yerevan, Zoravar Andranik Street, 115/2","40.167898,44.446233"
13623,"արամ խաչատրյանի փողոց 26, երևան","Armenia, Ararat Region, Village of Darbnik, Aram Khachatryan Street, 26","40.10815,44.378149"
13634,"մանթաշյանի փողոց 4/5, երևան","Armenia, Yerevan, Shirak Street, 4/5","40.141533,44.466993"
13649,"ազատամարտիկների պողոտա 87a, երևան","Armenia, Yerevan, The Administrative District of Erebuni, Azatamartikner Avenue, 87A","40.143484,44.52232"
13671,"արշակունյաց պողոտա 6, երևան","Armenia, Yerevan, Arshakunyats Avenue, 6","40.16978,44.507381"
13676,"զորավար անդրանիկի փողոց 80, երևան","Armenia, Yerevan, Zoravar Andranik Street, 80","40.1704,44.442011"
13683,"abovyan str 26, yerevan","Armenia, Yerevan, Abovyan Street, 26","40.184147,44.519832"
13688,"առնո բաբաջանյան փողոց 26/5, երևան","Armenia, Yerevan, Arno Babajanyan Street, 26/5","40.168546,44.437124"
13691,"ղազար փարպեցու փողոց 9b, երևան","Armenia, Yerevan, Ghazar Parpetsi Street, 9B","40.185717,44.510013"
13723,"գոհար գասպարյան փողոց, երևան","Armenia, Yerevan, Gohar Gasparyan Street","40.194618,44.51163"
13737,"hanrapetutyan street 79, yerevan","Armenia, Yerevan, Hanrapetutyan Street, 79","40.178924,44.520649"
13740,"ադոնցի փողոց 1, երևան","Armenia, Yerevan, Adonts Street, 1","40.2096,44.52903"
13754,"մհեր մկրտչյան փողոց, երևան","Armenia, Yerevan, Mher Mkrtchyan Street","40.174955,44.51207"
13755,"գրիգոր և սարգիս գուրզադյանների փողոց, երևան","Armenia, Yerevan, Grigor and Sargis Gurzadyan Street","40.156878,44.513508"
13761,"կոմիտասի պողոտա 45, երևան","Armenia, Yerevan, Komitas Avenue, 45","40.207017,44.51428"
13762,"դավթաշենի 1-ին փողոց, երևան","Armenia, Yerevan, Davtashen 1st Street","40.216177,44.480432"
13768,"արգիշտիի փողոց 13, երևան","Armenia, Yerevan, Argishti Street, 13","40.170172,44.503806"
