id,Address,found_address,coordinates
0,"օհանովի փողոց, երևան","Armenia, Yerevan, Ohanov Street","40.179944,44.447814"
1,"նորաշեն թաղամաս, երևան","Armenia, Yerevan, The Administrative District of Ajapnyak, Norashen Quarter","40.213333,44.469634"
2,"սուրբ գրիգոր լուսավորչի փողոց, երևան","Armenia, Yerevan, Surb Grigor Lusavorich Street","40.17419,44.505854"
3,"գյուլբենկյան փողոց, երևան","Armenia, Yerevan, Gyulbenkyan Street","40.200005,44.496116"
4,"ադոնցի փողոց, երևան","Armenia, Yerevan, Adonts Street","40.212375,44.522967"
5,"լենինգրադյան փողոց 48, երևան","Armenia, Yerevan, Kirk Kerkorian Street, 48","40.191298,44.466346"
6,"մանանդյան փողոց, երևան","Armenia, Yerevan, Manandyan Street","40.150688,44.483154"
7,"արշակունյաց պողոտա 39/9, երևան","Armenia, Yerevan, Arshakunyats Avenue, 39/9","40.157195,44.503599"
8,"բրյուսովի փողոց 21, երևան","Armenia, Yerevan, Bryusov Street, 21","40.167354,44.502845"
9,"սողոմոն տարոնցի փողոց, երևան","Armenia, Yerevan, Soghomon Taronts Street","40.145917,44.485166"
10,"պարույր սևակի փողոց, երևան","Armenia, Yerevan, Paruyr Sevak Street","40.205219,44.539613"
12,"սասնա ծռերի փողոց, երևան","Armenia, Yerevan, Sasna Tsrer Street","40.214125,44.489433"
13,"վազգեն սարգսյան փողոց, երևան","Armenia, Yerevan, Vazgen Sargsyan Street","40.176995,44.510624"
14,"գոգոլի փողոց, երևան","Armenia, Yerevan, Gogol Street","40.198655,44.543763"
15,"արշակունյաց պողոտա, երևան","Armenia, Yerevan, Arshakunyats Avenue","40.148909,44.497751"
16,"լենինգրադյան փողոց, երևան","Armenia, Yerevan, Kirk Kerkorian Street","40.191236,44.471044"
17,"դավթաշեն 4-րդ թաղամաս, երևան","Armenia, Yerevan, The Administrative District of Davtashen, Davtashen 4th Block","40.222106,44.499853"
18,"դերենիկ դեմիրճյանի փողոց, երևան","Armenia, Yerevan, The Administrative District of Kentron, Poqr Kentron District, Old Yerevan Quarter","40.180102,44.512268"
19,"աճառյան փողոց, երևան","Armenia, Yerevan, Acharyan Street","40.223249,44.56022"
20,"մոնթե մելքոնյան փողոց, երևան","Armenia, Yerevan, Monte Melkonyan Street","40.178255,44.480521"
21,"հին երևանցու փողոց, երևան","Armenia, Yerevan, Hin Yerevantsu Street","40.183747,44.513481"
22,"վիկտոր համբարձումյանի փողոց 47, երևան","Armenia, Armavir Region, Village of Parakar, Viktor Hambardzumyan Street","40.160993,44.393008"
23,"զաքարիա քանաքեռցու փողոց, երևան","Armenia, Yerevan, Zakaria Kanakertsi Street","40.222884,44.544796"
24,"տպագրիչների փողոց 8, երևան","Armenia, Yerevan, Tpagrichner Street, 8","40.177077,44.520353"
25,"հակոբ հակոբյան փողոց, երևան","Armenia, Yerevan, Hakob Hakobyan Street","40.200784,44.491059"
26,"նիկողայոս տիգրանյան փողոց, երևան","Armenia, Yerevan, Nikoghayos Tigranyan Street","40.208718,44.52047"
27,"բաղրամյան պողոտա, երևան","Armenia, Yerevan, Baghramyan Avenue","40.192249,44.504093"
28,"արամի փողոց, երևան","Armenia, Yerevan, Aram Street","40.179902,44.513211"
29,"ազատության պողոտա, երևան","Armenia, Yerevan, Azatutyan Avenue","40.203553,44.523838"
30,"գարեգին հովսեփյան փողոց, երևան","Armenia, Yerevan, Garegin Hovsepyan Street","40.178283,44.540161"
32,"երվանդ քոչարի փողոց, երևան","Armenia, Yerevan, Yervand Kochar Street","40.171247,44.517559"
33,"զորավար անդրանիկի փողոց, երևան","Armenia, Yerevan, Zoravar Andranik Street","40.175162,44.44573"
34,"դավիթ անհաղթի փողոց, երևան","Armenia, Yerevan, Davit Anhaght Street","40.202168,44.532291"
35,"տիգրան պետրոսյան փողոց, երևան","Armenia, Yerevan, Tigran Petrosyan Street","40.222898,44.495784"
36,"մինսկի փողոց, երևան","Armenia, Yerevan, Minsk Street","40.177608,44.576515"
37,"եղիշե թադևոսյան փողոց, երևան","Armenia, Yerevan, Yeghishe Tadevosyan Street","40.145621,44.489684"
38,"եկմալյան փողոց, երևան","Armenia, Yerevan, Yekmalyan Street","40.184732,44.508127"
39,"մարիա յակոբսեն փողոց, երևան","Armenia, Yerevan, Maria Jacobsen Street","40.201741,44.519679"
40,"տիգրան մեծի պողոտա 53, երևան","Armenia, Yerevan, Tigran Mets Avenue, 53","40.162764,44.513687"
41,"քաջազնունի փողոց 11, երևան","Armenia, Yerevan, Kajaznuni Street, 11","40.168718,44.521224"
42,"վրացական փողոց 7, երևան","Armenia, Yerevan, Vratsakan Street, 7","40.205743,44.509537"
43,"րաֆֆու փողոց, երևան","Armenia, Yerevan, Raffi Street","40.174218,44.447715"
44,"խանջյան փողոց 43, երևան","Armenia, Yerevan, Khanjyan Street, 43","40.180757,44.523254"
45,"առնո բաբաջանյան փողոց, երևան","Armenia, Yerevan, Arno Babajanyan Street","40.16734,44.438867"
47,"լենինգրադյան փողոց 25, երևան","Armenia, Yerevan, Kirk Kerkorian Street, 25","40.191112,44.472212"
48,"դավիթ հովհաննեսի փողոց 16, երևան","Armenia, Yerevan, Davit Hovhannes Street, 16","40.201838,44.508827"
49,"արաբկիրի 39-րդ փողոց, երևան","Armenia, Yerevan, Gevorg Vardanyan Street","40.202072,44.513085"
50,"անաստաս միկոյան փողոց, երևան","Armenia, Yerevan, Anastas Mikoyan Street","40.221059,44.502036"
51,"հանրապետության փողոց, երևան","Armenia, Yerevan, Hanrapetutyan Street","40.177801,44.518736"
52,"նազարբեկյան թաղամաս, երևան","Armenia, Yerevan, The Administrative District of Ajapnyak, Nazarbekyan Quarter","40.213278,44.460696"
53,"սարյան փողոց, երևան","Armenia, Yerevan, Saryan Street","40.184877,44.506339"
54,"ֆուչիկի փողոց, երևան","Armenia, Yerevan, Fuchik Street","40.205481,44.476892"
56,"գյուրջյան փողոց 11/5, երևան","Armenia, Yerevan, Gyurjyan Street, 11/5","40.192648,44.561855"
57,"տիգրան մեծի պողոտա, երևան","Armenia, Yerevan, Tigran Mets Avenue","40.166182,44.513112"
58,"էստոնական փողոց 10, երևան","Armenia, Yerevan, Estonakan Street, 10","40.196554,44.475724"
60,"վիկտոր համբարձումյան փողոց, երևան","Armenia, Yerevan, Viktor Hambardzumyan Street","40.197236,44.500635"
62,"ռոստոմի փողոց 29, երևան","Armenia, Yerevan, Rostom Street, 29","40.167368,44.518296"
63,"ռուբեն սևակի փողոց, երևան","Armenia, Yerevan, Ruben Sevak Street","40.201507,44.508962"
64,"շինարարների փողոց, երևան","Armenia, Yerevan, Shinararner Street","40.195238,44.473892"
65,"նարեկացու թաղամաս, երևան","Armenia, Yerevan, The Administrative District of Avan, Narekatsi District","40.219634,44.580639"
66,"բաղրամյան պողոտա 56, երևան","Armenia, Yerevan, Baghramyan Avenue, 56","40.193289,44.499054"
67,"սարմենի փողոց, երևան","Armenia, Yerevan, Sarmen Street","40.191815,44.512726"
70,"մարշալ բաղրամյան պողոտայի 2-րդ նրբանցք, երևան","Armenia, Yerevan, Marshal Baghramyan Avenue 2nd Lane","40.194329,44.498362"
71,"կոմիտասի պողոտա, երևան","Armenia, Yerevan, Komitas Avenue","40.206239,44.50721"
72,"գուսան շերամի փողոց, երևան","Armenia, Yerevan, Gusan Sheram Street","40.179923,44.441427"
74,"գյուլիքևխյան փողոց, երևան","Armenia, Yerevan, Gyulikevkhyan Street","40.186916,44.572527"
76,"բագրևանդի փողոց, երևան","Armenia, Yerevan, Bagrevand Street","40.200363,44.583181"
77,"տիչինայի փողոց, երևան","Armenia, Yerevan, Tychyna Street","40.18609,44.445936"
78,"վահրամ փափազյան փողոց, երևան","Armenia, Yerevan, Vahram Papazyan Street","40.204145,44.502351"
79,"թամանյան փողոց 3, երևան","Armenia, Yerevan, Tamanyan Street, 3","40.189707,44.51499"
80,"վարդանանց փողոց, երևան","Armenia, Yerevan, Vardanants Street","40.174211,44.521143"
82,"հրաչյա աճառյանի փողոց 39/25, երևան","Armenia, Yerevan, Acharyan Street, 39/25","40.224137,44.551677"
83,"artashisian st 88, yerevan","Armenia, Yerevan","40.177642,44.512519"
84,"գյուրջյան փողոց, երևան","Armenia, Yerevan, Gyurjyan Street","40.190871,44.559403"
85,"մոլդովական փողոց, երևան","Armenia, Yerevan, Moldovakan Street","40.19871,44.568511"
87,"արցախի պողոտա, երևան","Armenia, Yerevan, Artsakh Avenue","40.1355,44.510229"
89,"մեսրոպ մաշտոցի պողոտա, երևան","Armenia, Yerevan, Mashtots Avenue","40.182514,44.50969"
94,"մամիկոնյանց փողոց, երևան","Armenia, Yerevan, Mamikonyants Street","40.209352,44.516795"
95,"բրյուսովի փողոց, երևան","Armenia, Yerevan, Bryusov Street","40.167933,44.50439"
97,"բաշինջաղյան փողոց, երևան","Armenia, Yerevan, Bashinjaghyan Street","40.201169,44.468664"
98,"սարյանի փողոց, երևան","Armenia, Yerevan, Saryan Street","40.184877,44.506339"
99,"ֆրունզեի փողոց, երևան","Armenia, Yerevan, Frunze Street","40.147234,44.495487"
102,"քուչակ թաղամաս, երևան","Armenia, Yerevan, The Administrative District of Avan, Kuchak District","40.219021,44.577117"
103,"էստոնական փողոց, երևան","Armenia, Yerevan, Estonakan Street","40.196003,44.476533"
105,"կոմիտասի պողոտա 59, երևան","Armenia, Yerevan, Komitas Avenue, 59","40.206604,44.521637"
106,"սայաթ-նովայի պողոտա, երևան","Armenia, Yerevan, Sayat-Nova Avenue","40.181859,44.521206"
108,"առնո բաբաջանյան փողոց 75, երևան","Armenia, Yerevan, Arno Babajanyan Street, 75","40.166878,44.439882"
109,"պարոնյան փողոց 11, երևան","Armenia, Yerevan, Paronyan Street, 11","40.179406,44.500868"
110,"վարդանանց փողոց 22, երևան","Armenia, Yerevan, Vardanants Street, 22","40.172488,44.521296"
112,"հալաբյան փողոց, երևան","Armenia, Yerevan, Halabyan Street","40.199964,44.479632"
113,"գարեգին նժդեհի փողոց, երևան","Armenia, Yerevan, Garegin Nzhdeh Street","40.152046,44.497006"
114,"մանթաշյանի փողոց, երևան","Armenia, Yerevan, 1-ya ulitsa","40.222836,44.482794"
116,"թամանյան փողոց, երևան","Armenia, Yerevan, Tamanyan Street","40.189279,44.515152"
118,"լվովյան փողոց 31վ, երևան","Armenia, Yerevan, Lvovyan Street, 29","40.196926,44.556214"
122,"ավանեսովի փողոց, երևան","Armenia, Yerevan, Avanesov Street","40.131549,44.528815"
125,"արամ խաչատրյանի փողոց, երևան","Armenia, Ararat Region, Village of Darbnik, Aram Khachatryan Street","40.108798,44.378509"
126,"ծիծեռնակաբերդի խճուղի 1/2, երևան","Armenia, Yerevan, Tsitsernakaberd Highway, 1/2","40.178662,44.489334"
127,"աբելյան փողոց, երևան","Armenia, Yerevan, Abelyan Street","40.199158,44.477"
130,"նաիրի զարյան փողոց, երևան","Armenia, Yerevan, Nairi Zaryan Street","40.20431,44.515502"
131,"հրաչյա քոչարի փողոց, երևան","Armenia, Yerevan, Hrachya Kochar Street","40.201348,44.501821"
132,"ռուբինյանց փողոց 7, երևան","Armenia, Yerevan, Rubinyants Street, 7","40.200915,44.541939"
133,"փավստոս բուզանդի փողոց 7, երևան","Armenia, Yerevan, Pavstos Buzand Street, 7","40.179537,44.512124"
134,"ադմիրալ իսակովի պողոտա 4, երևան","Armenia, Yerevan, Tsovakal Isakov Avenue, 4","40.17295,44.492909"
135,"ադմիրալ իսակովի պողոտա, երևան","Armenia, Yerevan, Tsovakal Isakov Avenue","40.157229,44.459896"
137,"վիլնյուսի փողոց 21, երևան","Armenia, Yerevan, Vilnius Street, 21","40.172316,44.567802"
139,"մարշալ բաբաջանյանի փողոց, երևան","Armenia, Kotayk Region, Village of Arinj, Marshal Babajanyan 6th Street","40.238507,44.586738"
140,"տիգրան մեծի պողոտա 27a, երևան","Armenia, Yerevan, Tigran Mets Avenue, 27A","40.170069,44.513876"
141,"սիսակյան փողոց, երևան","Armenia, Yerevan, Sisakyan Street","40.192345,44.468026"
142,"ղազար փարպեցու փողոց, երևան","Armenia, Yerevan, Ghazar Parpetsi Street","40.184953,44.510319"
143,"սվաճյան փողոց, երևան","Armenia, Yerevan, Svachyan Street","40.175106,44.445397"
144,"մարգարյան 2-րդ նրբանցք, երևան","Armenia, Yerevan, Margaryan Street 2nd Lane","40.207238,44.471098"
146,"լեփսիուսի փողոց 39, երևան","Armenia, Yerevan, Lepsius Street, 39","40.210468,44.549512"
147,"պարոնյան փողոց, երևան","Armenia, Yerevan, Paronyan Street","40.183692,44.500491"
148,"տպագրիչների փողոց, երևան","Armenia, Yerevan, Tpagrichner Street","40.178014,44.519715"
149,"արամ խաչատրյան փողոց, երևան","Armenia, Yerevan, Aram Khachatryan Street","40.205281,44.498191"
150,"մաշտոցի պողոտա, երևան","Armenia, Yerevan, Mashtots Avenue","40.182514,44.50969"
153,"գալշոյան փողոց, երևան","Armenia, Yerevan, Galshoyan Street","40.182086,44.571152"
154,"անաստաս միկոյան փողոց 64/3, երևան","Armenia, Yerevan, Anastas Mikoyan Street, 64/3","40.21898,44.500814"
156,"էրեբունու փողոց, երևան","Armenia, Yerevan, Erebuni Street","40.141947,44.522311"
157,"ադոնցի փողոց 9, երևան","Armenia, Yerevan, Adonts Street, 9","40.210413,44.526767"
159,"սեբաստիայի փողոց, երևան","Armenia, Yerevan, Sebastia Street","40.176478,44.458396"
160,"դավթաշենի 1-ին զանգված, երևան","Armenia, Yerevan, Davtashen 1st Street","40.216177,44.480432"
161,"քեռու փողոց, երևան","Armenia, Yerevan, Qeri Street","40.199943,44.486792"
162,"ծարավ աղբյուրի փողոց, երևան","Armenia, Yerevan, Tsarav Akhpyur Street","40.218147,44.545838"
163,"չեխովի փողոց, երևան","Armenia, Yerevan, Chekhov Street","40.152549,44.479866"
164,"նալբանդյան փողոց, երևան","Armenia, Yerevan, Nalbandyan Street","40.18148,44.519787"
166,"եզնիկ կողբացու փողոց 1ա, երևան","Armenia, Yerevan, Yeznik Koghbatsi Street, 1A","40.179358,44.507148"
167,"բորյան փողոց, երևան","Armenia, Yerevan, Boryan Street","40.200343,44.559376"
168,"մինաս ավետիսյան փողոց, երևան","Armenia, Yerevan, Hunan Avetisyan Street","40.177601,44.565295"
169,"ավետիս ահարոնյանի փողոց, երևան","Armenia, Yerevan, 1-ya ulitsa","40.222836,44.482794"
170,"դրոյի փողոց, երևան","Armenia, Yerevan, Dro Street","40.204214,44.543008"
171,"թումանյան փողոց, երևան","Armenia, Yerevan, Tumanyan Street","40.182996,44.516589"
173,"վաղարշ վաղարշյան փողոց, երևան","Armenia, Yerevan, Vagharshyan Street","40.200804,44.499997"
177,"լեփսիուսի փողոց, երևան","Armenia, Yerevan, Lepsius Street","40.209455,44.544724"
179,"ալեք մանուկյանի փողոց, երևան","Armenia, Yerevan, Aram Manukyan Street","40.170303,44.453177"
181,"թոթովենցի փողոց, երևան","Armenia, Yerevan, Totovents Street","40.203132,44.568997"
186,"վերին շենգավիթի 2-րդ փողոց, երևան","Armenia, Yerevan, Verin Shengavit 2nd Street","40.154072,44.492945"
189,"անտառային փողոց, երևան","Armenia, Yerevan, Antarayin Street","40.192076,44.514837"
190,"улица молдовакан 43/4, yerevan","Armenia, Yerevan, Moldovakan Street, 43/4","40.198876,44.574153"
191,"հակոբ պարոնյանի փողոց 44, երևան","Armenia, Yerevan, Paronyan Street, 44","40.184849,44.503258"
193,"կարապետ ուլնեցու փողոց, երևան","Armenia, Yerevan, Karapet Ulnetsi Street","40.203869,44.534879"
194,"դավիթ մալյան փողոց 15, երևան","Armenia, Yerevan, Davit Malyan Street, 15","40.207603,44.563382"
198,"դուրյան թաղամաս, երևան","Armenia, Yerevan, The Administrative District of Avan, Duryan District","40.212947,44.581384"
204,"դավիթ բեկի 1-ին փողոց, երևան","Armenia, Yerevan, David-Bek 1st Street","40.148482,44.524817"
208,"դավթաշեն 3-րդ թաղամաս, երևան","Armenia, Yerevan, The Administrative District of Davtashen, Davtashen 3rd Block","40.217058,44.492164"
209,"մինսկի փողոց 17, երևան","Armenia, Yerevan, Minsk Street, 17","40.174066,44.574045"
211,"հերացու փողոց, երևան","Armenia, Yerevan, Heratsi Street","40.189155,44.528213"
212,"ծովակալ իսակովի պողոտա, երևան","Armenia, Yerevan, Tsovakal Isakov Avenue","40.157229,44.459896"
213,"շոպրոնի փողոց, երևան","Armenia, Yerevan, Shopron Street","40.186289,44.55881"
216,"խանջյան փողոց, երևան","Armenia, Yerevan, Khanjyan Street","40.176188,44.521458"
217,"եզնիկ կողբացու փողոց, երևան","Armenia, Yerevan, Yeznik Koghbatsi Street","40.181349,44.510723"
218,"նիկողայոս ադոնցի փողոց, երևան","Armenia, Yerevan, Adonts Street","40.212375,44.522967"
220,"աղբյուր սերոբի փողոց, երևան","Armenia, Yerevan, Aghbyur Serob Street","40.197153,44.50386"
222,"վրացական փողոց, երևան","Armenia, Yerevan, Vratsakan Street","40.206914,44.510453"
224,"դավթաշեն 2-րդ թաղամաս, երևան","Armenia, Yerevan, The Administrative District of Davtashen, Davtashen 2nd Block","40.225053,44.495065"
225,"մաշտոցի պողոտա 18, երևան","Armenia, Yerevan, Mashtots Avenue, 18","40.180329,44.507417"
228,"աբովյան փողոց, երևան","Armenia, Yerevan, Abovyan Street","40.184787,44.520137"
229,"դավթաշեն 1-ին թաղամաս, երևան","Armenia, Yerevan, The Administrative District of Davtashen, Davtashen 1st Block","40.220846,44.48875"
230,"բեկնազարյան փողոց 40, երևան","Armenia, Yerevan, Beknazaryan Street, 38/14","40.210881,44.471664"
231,"արգիշտի փողոց, երևան","Armenia, Yerevan, Argishti Street","40.174031,44.503159"
233,"հյուսիսային պողոտա, երևան","Armenia, Yerevan, Northern Avenue","40.182121,44.514613"
235,"շարուրի փողոց, երևան","Armenia, Yerevan, Sharuri Street","40.138782,44.459573"
238,"գրիբոյեդովի փողոց, երևան","Armenia, Yerevan, Griboyedov Street","40.209627,44.514083"
240,"կորյունի փողոց, երևան","Armenia, Yerevan, Koryun Street","40.188811,44.523093"
241,"ամիրյան փողոց, երևան","Armenia, Yerevan, Amiryan Street","40.180371,44.508441"
245,"azatutyan ave, yerevan","Armenia, Yerevan, Azatutyan Avenue","40.203553,44.523838"
248,"վարդանանց փողոց 26, երևան","Armenia, Yerevan, Vardanants Street, 26","40.171048,44.521458"
249,"սիմոն վրացյանի փողոց, երևան","Armenia, Yerevan, 1-ya ulitsa","40.222836,44.482794"
250,"ավան-առինջ 1-ին միկրոշրջան, երևան","Armenia, Yerevan, The Administrative District of Avan, Avan-Arinj 1st Microdistrict","40.220935,44.570901"
251,"գայի պողոտա, երևան","Armenia, Yerevan, Gai Avenue","40.19849,44.56729"
252,"rubinyants st 23, yerevan","Armenia, Yerevan, Rubinyants Street, 23","40.204131,44.549162"
253,"ռուբինյանց փողոց, երևան","Armenia, Yerevan, Rubinyants Street","40.203925,44.549871"
257,"լվովյան փողոցի նրբանցք, երևան","Armenia, Yerevan, Lvovyan Street Lane","40.201576,44.561064"
259,"պուշկինի փողոց 1, երևան","Armenia, Yerevan, Pushkin Street, 1","40.179764,44.516382"
260,"սարյան փողոց 2, երևան","Armenia, Yerevan, Saryan Street, 2","40.187495,44.509663"
262,"բագրատունյաց փողոց 22/3, երևան","Armenia, Yerevan, Bagratunyats Street, 22/3","40.14955,44.484824"
264,"ղափանցյան փողոց, երևան","Armenia, Yerevan, Ghapantsyan Street","40.219627,44.525123"
266,"շիրազի փողոց, երևան","Armenia, Yerevan, Shiraz Street","40.204717,44.461549"
269,"վերին անտառային փողոց, երևան","Armenia, Yerevan, Verin Antarayin Street","40.197422,44.510283"
274,"սևանի փողոց, երևան","Armenia, Yerevan, Sevan Street","40.158628,44.506923"
276,"զորավար անդրանիկի փողոց 117, երևան",,
281,"դավիթ մալյան փողոց, երևան","Armenia, Yerevan, Davit Malyan Street","40.209249,44.567757"
282,"խորենացու փողոց, երևան","Armenia, Yerevan, Khorenatsi Street","40.165969,44.515071"
284,"գարեգին նժդեհի փողոց 23/3, երևան","Armenia, Yerevan, Garegin Nzhdeh Street, 23/3","40.152969,44.494742"
286,"պուշկինի փողոց, երևան","Armenia, Yerevan, Pushkin Street","40.182913,44.512349"
292,"մարգարյան փողոց , երևան","Armenia, Yerevan, Margaryan Street","40.205082,44.475769"
295,"կարպ խաչվանքյանի փողոց 3/2, երևան","Armenia, Yerevan, Karp Khachvankyan Street, 3/2","40.2015,44.512528"
296,"արգիշտիի փողոց, երևան","Armenia, Yerevan, Argishti Street","40.174031,44.503159"
300,"այգեձորի փողոց, երևան","Armenia, Yerevan, Aygedzor Street","40.191553,44.498398"
301,"ներսիսյան փողոցի փակուղի, երևան","Armenia, Yerevan, Shirak Street 1st Deadlock","40.147986,44.444751"
303,"արամի փողոց 3, երևան","Armenia, Yerevan, Aram Street, 3","40.17953,44.513472"
305,"մարգարյան փողոց 37, երևան","Armenia, Yerevan, Margaryan Street, 37","40.203945,44.470757"
306,"անաստաս միկոյանի փողոց, երևան","Armenia, Yerevan, Tigran Mets Avenue","40.166182,44.513112"
308,"կոմիտասի պողոտա 3, երևան","Armenia, Yerevan, Komitas Avenue, 3","40.201948,44.495739"
309,"նանսենի փողոց 21/1, երևան","Armenia, Yerevan, Nansen Street, 21/1","40.19663,44.557444"
312,"գալշոյան փողոց 19, երևան","Armenia, Yerevan, Galshoyan Street, 19","40.180963,44.566535"
315,"մարգարյան փողոցի 1-ին նրբանցք, երևան","Armenia, Yerevan, Margaryan Street 1st Lane","40.206638,44.474736"
320,"խաղաղ դոնի փողոց, երևան","Armenia, Yerevan, Khaghagh Doni Street","40.128357,44.526713"
325,"գրիբոյեդովի փողոց 21/4, երևան","Armenia, Yerevan, Griboyedov Street, 21/4","40.21292,44.513705"
330,"միքայել չայլախյան փողոց, երևան","Armenia, Yerevan, Mikhail Chailakhyan Street","40.181025,44.528635"
333,"կիևյան փողոց, երևան","Armenia, Yerevan, Kievyan Street","40.195059,44.488427"
339,"տիգրան մեծի 1-ին նրբանցք, երևան","Armenia, Yerevan, The Administrative District of Kentron, Poqr Kentron District, Old Yerevan Quarter","40.180102,44.512268"
340,"ներքին շենգավիթի 11-րդ փողոց, երևան","Armenia, Yerevan, Vahram Aristakesyan Street","40.13901,44.484429"
343,"բակունցի փողոց, երևան","Armenia, Yerevan, Bakunts Street","40.190981,44.571557"
344,"արաբկիրի 21-րդ փողոց, երևան","Armenia, Yerevan, Ruben Sevak Street","40.201507,44.508962"
345,"հրաչյա աճառյանի փողոց, երևան","Armenia, Yerevan, Acharyan Street","40.223249,44.56022"
353,"երվանդ քոչարի փողոց 19, երևան","Armenia, Yerevan, Yervand Kochar Street, 19","40.169773,44.517128"
354,"նոր արեշի 15-րդ փողոց, երևան","Armenia, Yerevan, Nor Aresh 15th Street","40.13901,44.516032"
356,"օրբելի եղբայրների փողոց, երևան","Armenia, Yerevan, Orbeli Brothers Street","40.193365,44.492649"
359,"պարոնյան փողոց 2, երևան","Armenia, Yerevan, Paronyan Street, 2","40.178056,44.503285"
366,"վիկտոր համբարձումյանի փողոց 9, երևան","Armenia, Armavir Region, Village of Parakar, Viktor Hambardzumyan Street","40.160993,44.393008"
367,"nikoghayos adonts street, yerevan","Armenia, Yerevan, Adonts Street","40.212375,44.522967"
368,"մարշալ բաբաջանյան փողոց, երևան","Armenia, Yerevan, Marshal Babajanyan Street","40.219861,44.572617"
369,"մազմանյան փողոց, երևան","Armenia, Yerevan, Mazmanyan Street","40.208959,44.465259"
372,"ագաթանգեղոսի փողոց, երևան","Armenia, Yerevan, Agatangeghos Street","40.172364,44.511325"
376,"արգիշտիի փողոց 7/4, երևան","Armenia, Yerevan, Argishti Street, 7/4","40.170896,44.503689"
377,"հանրապետության փողոցի 2-րդ նրբանցք, երևան","Armenia, Yerevan, Hanrapetutyan Street 2nd Lane","40.178765,44.519769"
380,"արզումանյան փողոց, երևան","Armenia, Yerevan, Arzumanyan Street","40.193137,44.473497"
383,"ծիծեռնակաբերդի խճուղի , երևան","Armenia, Yerevan, Tsitsernakaberd Highway","40.181652,44.484833"
384,"բաշինջաղյան փողոց 2-րդ նրբանցք, երևան","Armenia, Yerevan, Bashinjaghyan Street 2nd Lane","40.205481,44.465591"
388,"լվովյան փողոց, երևան","Armenia, Yerevan, Lvovyan Street","40.201066,44.558729"
